timestamp,duration,activity,name,item,value,type,level
1664809529878,127372,0atztk77dzjcrf5bwhy5,Resilience,"Lately, I found new things to enjoy.",4,,
1664809529878,116527,0atztk77dzjcrf5bwhy5,Resilience,"Lately, I took action to improve my life.",4,,
1664809529878,85671,0atztk77dzjcrf5bwhy5,Resilience,"Lately, I was confident that I could overcome my limitations.",4,,
1664809529878,56972,0atztk77dzjcrf5bwhy5,Resilience,"Lately, I tried to see the positive side of things.",4,,
1664809529878,70343,0atztk77dzjcrf5bwhy5,Resilience,"Lately, I felt I can get through difficult times.",3,,
1664809529878,47140,0atztk77dzjcrf5bwhy5,Resilience,"Lately, I used positive ways to cope with my injury.",3,,
1664809529878,22865,0atztk77dzjcrf5bwhy5,Resilience,"Lately, I felt good about how I have coped with my injury",3,,
1664809529878,2944,0atztk77dzjcrf5bwhy5,Resilience,"Lately, I had a positive attitude.",3,,
