timestamp,duration,activity,name,item,value,type,level
1661300749050,203897,34j36dmwaebpkdcf4sb0,Resilience,"Lately, I found new things to enjoy.",3,,
1661300749050,184721,34j36dmwaebpkdcf4sb0,Resilience,"Lately, I took action to improve my life.",5,,
1661300749050,162622,34j36dmwaebpkdcf4sb0,Resilience,"Lately, I was confident that I could overcome my limitations.",3,,
1661300749050,141326,34j36dmwaebpkdcf4sb0,Resilience,"Lately, I tried to see the positive side of things.",5,,
1661300749050,119704,34j36dmwaebpkdcf4sb0,Resilience,"Lately, I felt I can get through difficult times.",3,,
1661300749050,96433,34j36dmwaebpkdcf4sb0,Resilience,"Lately, I used positive ways to cope with my injury.",5,,
1661300749050,55041,34j36dmwaebpkdcf4sb0,Resilience,"Lately, I felt good about how I have coped with my injury",3,,
1661300749050,10903,34j36dmwaebpkdcf4sb0,Resilience,"Lately, I had a positive attitude.",5,,
