timestamp,duration,activity,name,item,value,type,level
1667249165377,163028,34j36dmwaebpkdcf4sb0,Resilience,"Lately, I found new things to enjoy.",4,,
1667249165377,145511,34j36dmwaebpkdcf4sb0,Resilience,"Lately, I took action to improve my life.",4,,
1667249165377,130675,34j36dmwaebpkdcf4sb0,Resilience,"Lately, I was confident that I could overcome my limitations.",4,,
1667249165377,80535,34j36dmwaebpkdcf4sb0,Resilience,"Lately, I tried to see the positive side of things.",4,,
1667249165377,34652,34j36dmwaebpkdcf4sb0,Resilience,"Lately, I felt I can get through difficult times.",4,,
1667249165377,25039,34j36dmwaebpkdcf4sb0,Resilience,"Lately, I used positive ways to cope with my injury.",4,,
1667249165377,14436,34j36dmwaebpkdcf4sb0,Resilience,"Lately, I felt good about how I have coped with my injury",4,,
1667249165377,3872,34j36dmwaebpkdcf4sb0,Resilience,"Lately, I had a positive attitude.",5,,
