timestamp,duration,activity,name,item,value,type,level
1666625915155,112969,34j36dmwaebpkdcf4sb0,Resilience,"Lately, I found new things to enjoy.",5,,
1666625915155,96319,34j36dmwaebpkdcf4sb0,Resilience,"Lately, I took action to improve my life.",4,,
1666625915155,86406,34j36dmwaebpkdcf4sb0,Resilience,"Lately, I was confident that I could overcome my limitations.",4,,
1666625915155,64827,34j36dmwaebpkdcf4sb0,Resilience,"Lately, I tried to see the positive side of things.",4,,
1666625915155,53513,34j36dmwaebpkdcf4sb0,Resilience,"Lately, I felt I can get through difficult times.",4,,
1666625915155,36249,34j36dmwaebpkdcf4sb0,Resilience,"Lately, I used positive ways to cope with my injury.",4,,
1666625915155,23131,34j36dmwaebpkdcf4sb0,Resilience,"Lately, I felt good about how I have coped with my injury",4,,
1666625915155,13409,34j36dmwaebpkdcf4sb0,Resilience,"Lately, I had a positive attitude.",4,,
