timestamp,duration,activity,name,item,value,type,level
1665035481813,95640,pccfrtmmeg3e2ysd611w,Resilience,"Lately, I found new things to enjoy.",3,,
1665035481813,78874,pccfrtmmeg3e2ysd611w,Resilience,"Lately, I took action to improve my life.",5,,
1665035481813,64957,pccfrtmmeg3e2ysd611w,Resilience,"Lately, I was confident that I could overcome my limitations.",4,,
1665035481813,80904,pccfrtmmeg3e2ysd611w,Resilience,"Lately, I tried to see the positive side of things.",3,,
1665035481813,41775,pccfrtmmeg3e2ysd611w,Resilience,"Lately, I felt I can get through difficult times.",4,,
1665035481813,32736,pccfrtmmeg3e2ysd611w,Resilience,"Lately, I used positive ways to cope with my injury.",4,,
1665035481813,22362,pccfrtmmeg3e2ysd611w,Resilience,"Lately, I felt good about how I have coped with my injury",4,,
1665035481813,12680,pccfrtmmeg3e2ysd611w,Resilience,"Lately, I had a positive attitude.",4,,
