timestamp,duration,activity,name,item,value,type,level
1660706078614,277809,pccfrtmmeg3e2ysd611w,Resilience,"Lately, I found new things to enjoy.",3,,
1660706078614,229961,pccfrtmmeg3e2ysd611w,Resilience,"Lately, I took action to improve my life.",4,,
1660706078614,184402,pccfrtmmeg3e2ysd611w,Resilience,"Lately, I was confident that I could overcome my limitations.",3,,
1660706078614,591844,pccfrtmmeg3e2ysd611w,Resilience,"Lately, I tried to see the positive side of things.",4,,
1660706078614,97429,pccfrtmmeg3e2ysd611w,Resilience,"Lately, I felt I can get through difficult times.",3,,
1660706078614,41542,pccfrtmmeg3e2ysd611w,Resilience,"Lately, I used positive ways to cope with my injury.",3,,
1660706078614,25012,pccfrtmmeg3e2ysd611w,Resilience,"Lately, I felt good about how I have coped with my injury",3,,
1660706078614,7260,pccfrtmmeg3e2ysd611w,Resilience,"Lately, I had a positive attitude.",3,,
