timestamp,duration,activity,name,item,value,type,level
1667833023869,151216,pccfrtmmeg3e2ysd611w,Resilience,"Lately, I found new things to enjoy.",1,,
1667833023869,268034,pccfrtmmeg3e2ysd611w,Resilience,"Lately, I took action to improve my life.",4,,
1667833023869,171587,pccfrtmmeg3e2ysd611w,Resilience,"Lately, I was confident that I could overcome my limitations.",3,,
1667833023869,92292,pccfrtmmeg3e2ysd611w,Resilience,"Lately, I tried to see the positive side of things.",3,,
1667833023869,75158,pccfrtmmeg3e2ysd611w,Resilience,"Lately, I felt I can get through difficult times.",3,,
1667833023869,48226,pccfrtmmeg3e2ysd611w,Resilience,"Lately, I used positive ways to cope with my injury.",2,,
1667833023869,30495,pccfrtmmeg3e2ysd611w,Resilience,"Lately, I felt good about how I have coped with my injury",3,,
1667833023869,8348,pccfrtmmeg3e2ysd611w,Resilience,"Lately, I had a positive attitude.",3,,
